260930/LeanbotTinyRC_AI_PIDControl/heading_survey_results/heading_survey_20260930_161202.csv

direction,steps,signed_steps,intervalMs,heading,duration
0,0,0,1500,-11.61,4.765390396118164
0,0,0,1750,-11.52,5.2572243213653564
0,0,0,2000,-11.23,5.709824323654175
0,0,0,2250,-11.31,6.267550230026245
0,0,0,2500,-11.39,6.754946708679199
0,0,0,2750,-11.47,7.236870527267456
0,0,0,3000,-11.61,7.842151165008545
1,10,10,1500,-13.67,4.728494882583618
1,10,10,1750,-13.29,5.258872985839844
1,10,10,2000,-12.84,5.827437162399292
1,10,10,2250,-12.75,6.249855041503906
1,10,10,2500,-12.59,6.8139238357543945
1,10,10,2750,-12.61,7.244550943374634
1,10,10,3000,-12.75,7.76130485534668
-1,10,0,1500,-13.53,4.724964141845703
-1,10,0,1750,-13.14,5.250171899795532
-1,10,0,2000,-12.91,5.7229931354522705
-1,10,0,2250,-13.25,6.248013019561768
-1,10,0,2500,-13.29,6.813564777374268

260903/Readme.md

### 2. Chạy inference đánh giá với cấu hình : Kp_angle2 = 0.02 , angle_tolerance 10 -> 15 -> 20

- **Trường hợp 2:**
  - **Thời gian di chuyển:** ~11.3 giây (170 frames)
  - **Thời gian Pha 1 (ALIGNING):** ~3.9 giây (60 frames)
  - **Thời gian Pha 2 (DRIVING):** ~7.2 giây (109 frames)
  - **Sai số cự ly cuối:** 10.2 px

- **Trường hợp 4:**
  - **Thời gian di chuyển:** ~12.6 giây (191 frames)
  - **Thời gian Pha 1 (ALIGNING):** ~4.0 giây (61 frames)
  - **Thời gian Pha 2 (DRIVING):** ~8.5 giây (129 frames)
  - **Sai số cự ly cuối:** 12.8 px

- **Trường hợp 2:**
  - **Thời gian di chuyển:** ~11.4 giây (171 frames)
  - **Thời gian Pha 1 (ALIGNING):** ~2.5 giây (38 frames)
  - **Thời gian Pha 2 (DRIVING):** ~8.8 giây (132 frames)
  - **Sai số cự ly cuối:** 11.0 px

- **Trường hợp 3:**
  - **Thời gian di chuyển:** ~13.5 giây (205 frames)
  - **Thời gian Pha 1 (ALIGNING):** ~2.8 giây (43 frames)
  - **Thời gian Pha 2 (DRIVING):** ~10.7 giây (161 frames)
  - **Sai số cự ly cuối:** 10.8 px

- **Trường hợp 4:**
  - **Thời gian di chuyển:** ~11.5 giây (174 frames)
  - **Thời gian Pha 1 (ALIGNING):** ~3.8 giây (58 frames)
  - **Thời gian Pha 2 (DRIVING):** ~7.6 giây (115 frames)
  - **Sai số cự ly cuối:** 10.1 px

- **Trường hợp 3:**
  - **Thời gian di chuyển:** ~13.1 giây (197 frames)
  - **Thời gian Pha 1 (ALIGNING):** ~2.4 giây (38 frames)
  - **Thời gian Pha 2 (DRIVING):** ~10.5 giây (158 frames)
  - **Sai số cự ly cuối:** 10.5 px

- **Trường hợp 4:**
  - **Thời gian di chuyển:** ~13.7 giây (203 frames)
  - **Thời gian Pha 1 (ALIGNING):** ~4.0 giây (60 frames)
  - **Thời gian Pha 2 (DRIVING):** ~9.6 giây (142 frames)
  - **Sai số cự ly cuối:** 11.3 px